{
  "$schema": "urn:omarchy:ultimate:product-contracts:processes-v0",
  "schemaVersion": "v0",
  "contractStatus": "provisional-v0",
  "principals": [
    { "id": "principal.shell.shared-session", "scope": "shared-shell", "bindingState": "legacy-shared", "description": "The one Quickshell process, including enabled third-party QML, is one current principal and receives no standing high-risk authority.", "debtIds": ["debt.process.shared-shell-principal"] },
    { "id": "principal.desktop-app.dynamic", "scope": "desktop-application", "bindingState": "legacy-dynamic", "description": "Desktop applications are currently inferred from desktop entry ids and compositor classes rather than bound to stable product principals.", "debtIds": ["debt.identity.heuristic-window-join"] },
    { "id": "principal.compositor.external", "scope": "compositor", "bindingState": "external", "description": "Hyprland is an external session process; product providers issue fixed compositor operations rather than claiming to own it.", "debtIds": [] }
  ],
  "processes": [
    { "id": "process.omarchy-shell", "principalId": "principal.shell.shared-session", "ownerPath": "shell/shell.qml", "executable": "quickshell -n -p shell/shell.qml", "state": "present", "owns": ["first-party plugin hosting", "shared shell services", "legacy Quickshell IPC endpoints"], "debtIds": ["debt.process.shared-shell-principal", "debt.ipc.caller-unbound"] },
    { "id": "process.desktop-app.dynamic", "principalId": "principal.desktop-app.dynamic", "ownerPath": null, "executable": "desktop-entry-defined", "state": "dynamic", "owns": ["application windows and application-defined single-instance behavior"], "debtIds": ["debt.identity.heuristic-window-join"] },
    { "id": "process.hyprland", "principalId": "principal.compositor.external", "ownerPath": null, "executable": "Hyprland", "state": "external", "owns": ["compositor window, workspace, monitor, and layer-surface state"], "debtIds": [] }
  ],
  "invocationComponents": [
    { "id": "component.agents-main", "path": "shell/plugins/agents/Main.qml", "componentKind": "provider", "processId": "process.omarchy-shell", "processRole": "provider", "mutationClass": "mixed", "claimsProcessOwnership": false, "capabilityIds": [], "humanRoutes": ["route.surface.omarchy.agents"], "state": "legacy-direct", "debtIds": ["debt.process.consumer-direct-execution", "debt.process.shared-shell-principal"] },
    { "id": "component.background", "path": "shell/plugins/background/Background.qml", "componentKind": "provider", "processId": "process.omarchy-shell", "processRole": "provider", "mutationClass": "persistent", "claimsProcessOwnership": false, "capabilityIds": [], "humanRoutes": ["route.surface.omarchy.menu"], "state": "legacy-direct", "debtIds": ["debt.process.consumer-direct-execution", "debt.process.shared-shell-principal"] },
    { "id": "component.bar-host", "path": "shell/plugins/bar/Bar.qml", "componentKind": "consumer-ui", "processId": "process.omarchy-shell", "processRole": "consumer", "mutationClass": "mixed", "claimsProcessOwnership": false, "capabilityIds": [], "humanRoutes": ["Superbar"], "state": "legacy-direct", "debtIds": ["debt.process.consumer-direct-execution", "debt.process.shared-shell-principal"] },
    { "id": "component.indicator-dictation", "path": "shell/plugins/bar/indicators/Dictation.qml", "componentKind": "consumer-ui", "processId": "process.omarchy-shell", "processRole": "consumer", "mutationClass": "mixed", "claimsProcessOwnership": false, "capabilityIds": [], "humanRoutes": ["Superbar indicators"], "state": "legacy-direct", "debtIds": ["debt.process.consumer-direct-execution", "debt.process.shared-shell-principal"] },
    { "id": "component.indicator-reminder", "path": "shell/plugins/bar/indicators/Reminder.qml", "componentKind": "consumer-ui", "processId": "process.omarchy-shell", "processRole": "consumer", "mutationClass": "mixed", "claimsProcessOwnership": false, "capabilityIds": [], "humanRoutes": ["route.surface.omarchy.reminders"], "state": "legacy-direct", "debtIds": ["debt.process.consumer-direct-execution", "debt.process.shared-shell-principal"] },
    { "id": "component.indicator-screen-recording", "path": "shell/plugins/bar/indicators/ScreenRecording.qml", "componentKind": "consumer-ui", "processId": "process.omarchy-shell", "processRole": "consumer", "mutationClass": "mixed", "claimsProcessOwnership": false, "capabilityIds": [], "humanRoutes": ["Superbar indicators"], "state": "legacy-direct", "debtIds": ["debt.process.consumer-direct-execution", "debt.process.shared-shell-principal"] },
    { "id": "component.keyboard-layout", "path": "shell/plugins/bar/widgets/KeyboardLayout.qml", "componentKind": "consumer-ui", "processId": "process.omarchy-shell", "processRole": "consumer", "mutationClass": "session", "claimsProcessOwnership": false, "capabilityIds": [], "humanRoutes": ["Superbar keyboard layout"], "state": "legacy-direct", "debtIds": ["debt.process.consumer-direct-execution", "debt.process.shared-shell-principal"] },
    { "id": "component.system-update-widget", "path": "shell/plugins/bar/widgets/SystemUpdate.qml", "componentKind": "consumer-ui", "processId": "process.omarchy-shell", "processRole": "consumer", "mutationClass": "mixed", "claimsProcessOwnership": false, "capabilityIds": [], "humanRoutes": ["Superbar update indicator"], "state": "legacy-direct", "debtIds": ["debt.process.consumer-direct-execution", "debt.process.shared-shell-principal"] },
    { "id": "component.clipboard", "path": "shell/plugins/clipboard/Clipboard.qml", "componentKind": "consumer-ui", "processId": "process.omarchy-shell", "processRole": "consumer", "mutationClass": "mixed", "claimsProcessOwnership": false, "capabilityIds": [], "humanRoutes": ["route.surface.omarchy.clipboard"], "state": "legacy-direct", "debtIds": ["debt.process.consumer-direct-execution", "debt.process.shared-shell-principal"] },
    { "id": "component.emojis", "path": "shell/plugins/emojis/Emojis.qml", "componentKind": "consumer-ui", "processId": "process.omarchy-shell", "processRole": "consumer", "mutationClass": "session", "claimsProcessOwnership": false, "capabilityIds": [], "humanRoutes": ["route.surface.omarchy.emojis"], "state": "legacy-direct", "debtIds": ["debt.process.consumer-direct-execution", "debt.process.shared-shell-principal"] },
    { "id": "component.image-picker", "path": "shell/plugins/image-picker/ImagePicker.qml", "componentKind": "consumer-ui", "processId": "process.omarchy-shell", "processRole": "consumer", "mutationClass": "mixed", "claimsProcessOwnership": false, "capabilityIds": [], "humanRoutes": ["route.surface.omarchy.image-picker"], "state": "legacy-direct", "debtIds": ["debt.process.consumer-direct-execution", "debt.process.shared-shell-principal"] },
    { "id": "component.lock-service", "path": "shell/plugins/lock/Service.qml", "componentKind": "provider", "processId": "process.omarchy-shell", "processRole": "provider", "mutationClass": "session", "claimsProcessOwnership": false, "capabilityIds": [], "humanRoutes": ["Start lock button"], "state": "legacy-direct", "debtIds": ["debt.process.consumer-direct-execution", "debt.process.shared-shell-principal"] },
    { "id": "component.menu", "path": "shell/plugins/menu/Menu.qml", "componentKind": "consumer-ui", "processId": "process.omarchy-shell", "processRole": "consumer", "mutationClass": "mixed", "claimsProcessOwnership": false, "capabilityIds": [], "humanRoutes": ["route.surface.omarchy.menu"], "state": "legacy-direct", "debtIds": ["debt.process.consumer-direct-execution", "debt.search.untyped-mutations", "debt.process.shared-shell-principal"] },
    { "id": "component.notifications-service", "path": "shell/plugins/notifications/Service.qml", "componentKind": "provider", "processId": "process.omarchy-shell", "processRole": "provider", "mutationClass": "mixed", "claimsProcessOwnership": false, "capabilityIds": [], "humanRoutes": ["Notification popups and shortcuts"], "state": "legacy-direct", "debtIds": ["debt.process.consumer-direct-execution", "debt.process.shared-shell-principal"] },
    { "id": "component.audio-panel", "path": "shell/plugins/panels/audio/Panel.qml", "componentKind": "consumer-ui", "processId": "process.omarchy-shell", "processRole": "consumer", "mutationClass": "session", "claimsProcessOwnership": false, "capabilityIds": [], "humanRoutes": ["route.surface.omarchy.audio"], "state": "legacy-direct", "debtIds": ["debt.process.consumer-direct-execution", "debt.process.shared-shell-principal"] },
    { "id": "component.bluetooth-panel", "path": "shell/plugins/panels/bluetooth/Panel.qml", "componentKind": "consumer-ui", "processId": "process.omarchy-shell", "processRole": "consumer", "mutationClass": "persistent", "claimsProcessOwnership": false, "capabilityIds": [], "humanRoutes": ["route.surface.omarchy.bluetooth"], "state": "legacy-direct", "debtIds": ["debt.process.consumer-direct-execution", "debt.process.shared-shell-principal"] },
    { "id": "component.disk-speedtest-panel", "path": "shell/plugins/panels/disk-speedtest/Panel.qml", "componentKind": "consumer-ui", "processId": "process.omarchy-shell", "processRole": "consumer", "mutationClass": "mixed", "claimsProcessOwnership": false, "capabilityIds": [], "humanRoutes": ["route.surface.omarchy.disk-speedtest"], "state": "legacy-direct", "debtIds": ["debt.process.consumer-direct-execution", "debt.process.shared-shell-principal"] },
    { "id": "component.dropbox-service", "path": "shell/plugins/panels/dropbox/Service.qml", "componentKind": "provider", "processId": "process.omarchy-shell", "processRole": "provider", "mutationClass": "mixed", "claimsProcessOwnership": false, "capabilityIds": [], "humanRoutes": ["route.surface.omarchy.dropbox"], "state": "legacy-direct", "debtIds": ["debt.process.consumer-direct-execution", "debt.process.shared-shell-principal"] },